{
  "id": "lib-cw15",
  "kind": "uas",
  "type": "vtol",
  "version": 2,
  "name": "Red air: CW-15 class VTOL ISR (G2)",
  "description": "VTOL fixed-wing ISR. Launches from any clearing 20-50 km out; long racetrack orbits at 1500-5000 ft.",
  "color": "#bd6355",
  "builtin": true,
  "spec": "uas",
  "fields": {
    "group": {
      "value": 2,
      "unit": "uas-group",
      "grade": "INFERRED",
      "layer": "L2",
      "estimator": "planning-factor",
      "note": "No provenance row; planning factor"
    },
    "rcsM2": {
      "value": 0.05,
      "unit": "m2",
      "condition": "0.05 m2",
      "grade": "INFERRED",
      "layer": "L2",
      "basis": "pf",
      "source": "planning factor",
      "url": null,
      "date": "2026-09-04",
      "estimator": "planning-factor"
    },
    "spanM": {
      "value": 3.54,
      "unit": "m",
      "condition": "3.54 m wingspan",
      "grade": "MANUFACTURER_CLAIM",
      "layer": "L1",
      "basis": "datasheet",
      "source": "JOUAV CW-15 product page",
      "url": "https://www.jouav.com/products/cw-15.html",
      "date": "2026-09-04"
    },
    "acousticDb": {
      "value": 80,
      "unit": "dB",
      "grade": "INFERRED",
      "layer": "L2",
      "estimator": "planning-factor",
      "note": "No provenance row; planning factor"
    },
    "cruiseSpeedMps": {
      "value": 17,
      "unit": "mps",
      "condition": "61 km/h cruise speed (16.9 m/s)",
      "grade": "MANUFACTURER_CLAIM",
      "layer": "L1",
      "basis": "datasheet",
      "source": "JOUAV CW-15 product page",
      "url": "https://www.jouav.com/products/cw-15.html",
      "date": "2026-09-04"
    },
    "maxSpeedMps": {
      "value": 25,
      "unit": "mps",
      "grade": "INFERRED",
      "layer": "L2",
      "estimator": "planning-factor",
      "note": "No provenance row; planning factor"
    },
    "enduranceMin": {
      "value": 180,
      "unit": "min",
      "condition": "180 min empty",
      "grade": "MANUFACTURER_CLAIM",
      "layer": "L1",
      "basis": "datasheet",
      "source": "JOUAV CW-15 product page",
      "url": "https://www.jouav.com/products/cw-15.html",
      "date": "2026-09-04"
    },
    "altBandFt": {
      "value": [
        1000,
        6000
      ],
      "unit": "ft",
      "grade": "INFERRED",
      "layer": "L2",
      "estimator": "planning-factor",
      "note": "No provenance row; planning factor"
    },
    "controlLinkRangeM": {
      "value": 50000,
      "unit": "m",
      "grade": "INFERRED",
      "layer": "L2",
      "estimator": "planning-factor",
      "note": "No provenance row; planning factor"
    },
    "operatingRadiusM": {
      "value": 50000,
      "unit": "m",
      "grade": "INFERRED",
      "layer": "L2",
      "estimator": "planning-factor",
      "note": "No provenance row; planning factor"
    },
    "combatRadiusM": {
      "value": 50000,
      "unit": "m",
      "grade": "INFERRED",
      "layer": "L2",
      "estimator": "planning-factor",
      "note": "No provenance row; planning factor"
    },
    "warheadKg": {
      "value": null,
      "unit": "kg",
      "grade": "UNKNOWN",
      "layer": "L3"
    },
    "effectRadiusM": {
      "value": null,
      "unit": "m",
      "grade": "UNKNOWN",
      "layer": "L3"
    },
    "standoffRangeM": {
      "value": null,
      "unit": "m",
      "grade": "UNKNOWN",
      "layer": "L3"
    },
    "maxTurnRateDegS": {
      "value": 33,
      "unit": "deg/s",
      "grade": "INFERRED",
      "layer": "L2",
      "estimator": "planning-factor",
      "spread": {
        "kind": "lognormal",
        "sigmaDb": 4
      },
      "note": "Planning factor: coordinated-turn rate g tan(bank) / V. The 45° roll limit is the ArduPlane default (ROLL_LIMIT_DEG 45; PX4 FW_R_LIM 50°), the autopilot class these small fixed-wing UAS fly with. At the record's cruise speed 17 m/s: 33°/s. No turn rate, bank limit or g limit is published for this airframe."
    },
    "climbRateMps": {
      "value": 5,
      "unit": "mps",
      "grade": "INFERRED",
      "layer": "L2",
      "estimator": "planning-factor",
      "spread": {
        "kind": "lognormal",
        "sigmaDb": 4
      },
      "note": "Planning factor: JOUAV publishes no climb rate. The ArduPlane TECS_CLMB_MAX default and the PX4 FW_T_CLMB_MAX default are both 5.0 m/s for a small fixed-wing UAS."
    },
    "maxAccelMps2": {
      "value": 2,
      "unit": "mps2",
      "grade": "INFERRED",
      "layer": "L2",
      "estimator": "planning-factor",
      "spread": {
        "kind": "lognormal",
        "sigmaDb": 4
      },
      "note": "Planning factor: JOUAV publishes no acceleration. MTOW 17 kg with a 3 kg payload (reseller sheet; OEM page). A propeller airframe with thrust-to-weight near 0.3 and cruise drag near 0.1 of weight accelerates at about 0.2 g = 2 m/s² in level flight."
    },
    "radiatedPowerW": {
      "value": 2,
      "unit": "W",
      "grade": "INFERRED",
      "layer": "L2",
      "estimator": "planning-factor",
      "spread": {
        "kind": "lognormal",
        "sigmaDb": 4
      },
      "note": "Planning factor: JOUAV publishes no link power. JOUAV names a 1.4 GHz data link held beyond 47 km in its own test but gives no power; the FCC ID 2BDP3-CW15 filing was unreachable today. The only OEM-published link power in this threat set is Mugin's SprintLink family (2 W, 5 W, 10 W at 1.4 GHz for 30 to 150 km); the 2 W entry-level class is used for a small-UAS command and video link."
    }
  },
  "attributes": {
    "irSignature": "low",
    "airframe": "vtol",
    "navMode": "mixed",
    "emissionsNote": "Digital datalink, directional antenna",
    "oneWay": false,
    "rangeNote": "Legs beyond 100 km reported for the class; combat ISR bounded by ~50 km datalink.",
    "weaponProfile": "none",
    "linkProtocol": "proprietary"
  },
  "provenanceOrder": [
    "rcsM2",
    "spanM",
    "cruiseSpeedMps",
    "enduranceMin"
  ],
  "threatProfile": {
    "designator": "THR-G2-V-01",
    "routeIntent": "Persistent standoff ISR racetrack",
    "altitudeFt": 3000,
    "speedMps": 17,
    "count": 1
  },
  "attributeProvenance": {
    "linkProtocol": {
      "value": "proprietary",
      "source": "JOUAV long-range drone article: CW-15 1.4 GHz data link held at over 47 km",
      "url": "https://www.jouav.com/blog/long-range-drone.html",
      "date": "2026-09-10",
      "basis": "datasheet",
      "grade": "MANUFACTURER_CLAIM",
      "layer": "L1"
    }
  }
}
