{
  "id": "lib-hdcmr",
  "kind": "sensor",
  "type": "eo-ir",
  "version": 3,
  "name": "Ranger HDC MR EO/IR (FLIR)",
  "description": "Mid-range pan-tilt thermal and color imager for visual identification of radar-cued tracks. 360 deg slewable.",
  "color": "#a49bc4",
  "builtin": true,
  "spec": "sensor",
  "fields": {
    "refSpanM": {
      "value": 0.4,
      "unit": "m",
      "grade": "INFERRED",
      "layer": "L2",
      "estimator": "planning-factor",
      "note": "No provenance row; planning factor"
    },
    "detectRangeM": {
      "value": 3000,
      "unit": "m",
      "rangeType": "detection",
      "condition": "3000 m",
      "grade": "INFERRED",
      "layer": "L2",
      "basis": "pf",
      "source": "planning factor",
      "url": null,
      "date": "2026-09-04",
      "estimator": "planning-factor"
    },
    "classifyRangeM": {
      "value": 1500,
      "unit": "m",
      "rangeType": "classification",
      "condition": "planning figure",
      "grade": "INFERRED",
      "layer": "L2",
      "estimator": "planning-factor",
      "note": "No provenance row; planning factor"
    },
    "sectorDeg": {
      "value": 360,
      "unit": "deg",
      "condition": "360 deg azimuth range",
      "grade": "MANUFACTURER_CLAIM",
      "layer": "L1",
      "basis": "datasheet",
      "source": "Teledyne FLIR Ranger HDC MR datasheet (rev 08/31/21), mirror host atline.pl",
      "url": "https://www.atline.pl/images/design/pdf/FLIR-Ranger-HDC-MR.pdf",
      "date": "2026-09-04"
    },
    "elevationDeg": {
      "value": [
        -35,
        90
      ],
      "unit": "deg",
      "condition": "-35 to 90 deg elevation range",
      "grade": "MANUFACTURER_CLAIM",
      "layer": "L1",
      "basis": "datasheet",
      "source": "Teledyne FLIR Ranger HDC MR datasheet (rev 08/31/21), mirror host atline.pl",
      "url": "https://www.atline.pl/images/design/pdf/FLIR-Ranger-HDC-MR.pdf",
      "date": "2026-09-04"
    },
    "maxAltitudeFt": {
      "value": null,
      "unit": "ft",
      "grade": "UNKNOWN",
      "layer": "L3"
    },
    "resolutionM": {
      "value": 20,
      "unit": "m",
      "grade": "INFERRED",
      "layer": "L2",
      "estimator": "planning-factor",
      "note": "No provenance row; planning factor"
    },
    "rangeAccuracyM": {
      "value": 5,
      "unit": "m",
      "grade": "INFERRED",
      "layer": "L2",
      "estimator": "planning-factor",
      "spread": {
        "kind": "lognormal",
        "sigmaDb": 4
      },
      "note": "Planning factor: the mid-range (10 km) laser rangefinder is optional; eyesafe 1.54 µm rangefinders in this class are specified at ±2 to ±5 m, so 5 m is recorded for a unit fitted with it."
    },
    "azimuthAccuracyDeg": {
      "value": 0.029,
      "unit": "deg",
      "condition": "pan and tilt unit accuracy ±0.5 mrad (0.029°); the imager centroid adds nothing at this scale",
      "grade": "MANUFACTURER_CLAIM",
      "layer": "L1",
      "source": "Teledyne FLIR Ranger HDC MR datasheet (mirror at atline.pl), pan and tilt unit accuracy ±0.5 mrad",
      "url": "https://www.atline.pl/images/design/pdf/FLIR-Ranger-HDC-MR.pdf",
      "date": "2026-09-10",
      "spread": {
        "kind": "lognormal",
        "sigmaDb": 2
      }
    },
    "elevationAccuracyDeg": {
      "value": 0.029,
      "unit": "deg",
      "condition": "pan and tilt unit accuracy ±0.5 mrad (0.029°)",
      "grade": "MANUFACTURER_CLAIM",
      "layer": "L1",
      "source": "Teledyne FLIR Ranger HDC MR datasheet (mirror at atline.pl), pan and tilt unit accuracy ±0.5 mrad",
      "url": "https://www.atline.pl/images/design/pdf/FLIR-Ranger-HDC-MR.pdf",
      "date": "2026-09-10",
      "spread": {
        "kind": "lognormal",
        "sigmaDb": 2
      }
    },
    "pixelPitchUm": {
      "value": 12,
      "unit": "um",
      "grade": "INFERRED",
      "layer": "L2",
      "estimator": "planning-factor",
      "spread": {
        "kind": "lognormal",
        "sigmaDb": 4
      },
      "note": "Planning factor: the HDC MR sheet gives a 1280 x 720 InSb array and no pitch. Teledyne FLIR's HD InSb cores of that generation (Neutrino SX12, 1280 x 1024) are 12 µm; recorded as 12 µm."
    },
    "focalLengthMm": {
      "value": 290,
      "unit": "mm",
      "grade": "INFERRED",
      "layer": "L2",
      "estimator": "planning-factor",
      "spread": {
        "kind": "lognormal",
        "sigmaDb": 4
      },
      "note": "Planning factor: FLIR publishes only '>12x optical zoom' for the thermal channel. From the HDC 350 narrow field 3.0° and an assumed 12 µm × 1280 px = 15.4 mm array width: 15.4 / (2 tan 1.5°) = 293 mm, recorded as 290 mm. The HDC 550 lens option (1.9° narrow) would give about 460 mm."
    },
    "detectorPixelsH": {
      "value": 1280,
      "unit": "count",
      "condition": "cooled InSb 1280 x 720, 3 to 5 µm",
      "grade": "REPORTED",
      "layer": "L1",
      "basis": "datasheet",
      "source": "Teledyne FLIR Ranger HDC MR datasheet 21-0714 (mirror at atline.pl; defense.flir.com returned 403)",
      "url": "https://www.atline.pl/images/design/pdf/FLIR-Ranger-HDC-MR.pdf",
      "date": "2026-09-10"
    },
    "fovDeg": {
      "value": 3,
      "unit": "deg",
      "condition": "HDC 350 cooled lens option, narrow field 3.0° x 1.7° ±7%; the HDC 550 option gives 1.9° x 1.08°",
      "grade": "REPORTED",
      "layer": "L1",
      "basis": "datasheet",
      "source": "Teledyne FLIR Ranger HDC MR datasheet 21-0714 (mirror at atline.pl; defense.flir.com returned 403)",
      "url": "https://www.atline.pl/images/design/pdf/FLIR-Ranger-HDC-MR.pdf",
      "date": "2026-09-10",
      "spread": {
        "kind": "lognormal",
        "sigmaDb": 2
      }
    },
    "mrtdMk": {
      "value": 25,
      "unit": "mK",
      "grade": "INFERRED",
      "layer": "L2",
      "estimator": "planning-factor",
      "spread": {
        "kind": "lognormal",
        "sigmaDb": 4
      },
      "note": "Planning factor: FLIR publishes no MRTD or NETD for the HDC MR. Cooled HD MWIR cores publish NETD of 20 mK (Lynred Daphnis-HD MW), <25 mK (Teledyne FLIR Neutrino SX12) and <30 mK (DRS HexaBlu 1280-MW); the 25 mK median is used as the low-spatial-frequency MRTD."
    }
  },
  "attributes": {
    "sensorType": "eo-ir",
    "role": "classification",
    "eoBand": "dual"
  },
  "provenanceOrder": [
    "detectRangeM",
    "eoBand",
    "sectorDeg",
    "elevationDeg"
  ],
  "attributeProvenance": {
    "eoBand": {
      "value": "dual: HD thermal imager plus a 1920 x 1080 HD colour TV camera",
      "source": "Teledyne FLIR Ranger HDC MR datasheet (rev 08/31/21), mirror host atline.pl",
      "url": "https://www.atline.pl/images/design/pdf/FLIR-Ranger-HDC-MR.pdf",
      "date": "2026-09-04",
      "basis": "datasheet",
      "grade": "MANUFACTURER_CLAIM",
      "layer": "L1"
    }
  }
}
