{
  "id": "lib-rps62",
  "kind": "sensor",
  "type": "radar",
  "version": 3,
  "name": "RPS-62 radar panel (RADA MHR)",
  "description": "Larger S-band MHR-family panel. Northrop names MHR/RPS-42/62/82 among FAAD C2 supported sensors, but no range figure is published for the RPS-62: both rings are planning figures.",
  "color": "#89b0c9",
  "builtin": true,
  "spec": "sensor",
  "fields": {
    "detectRangeM": {
      "value": 3000,
      "unit": "m",
      "rangeType": "detection",
      "condition": "3000 m against nano-UAV (15 km medium UAV, 22 km fighter)",
      "grade": "REPORTED",
      "layer": "L1",
      "basis": "reference",
      "source": "EDR Magazine, DSEI 2019 RADA report",
      "url": "https://www.edrmagazine.eu/dsei-2019-rada-two-new-radars-from-israel",
      "date": "2026-09-04"
    },
    "classifyRangeM": {
      "value": 8000,
      "unit": "m",
      "rangeType": "classification",
      "condition": "planning figure",
      "grade": "INFERRED",
      "layer": "L2",
      "estimator": "planning-factor",
      "note": "No provenance row; planning factor"
    },
    "sectorDeg": {
      "value": 90,
      "unit": "deg",
      "condition": "90 deg",
      "grade": "REPORTED",
      "layer": "L1",
      "basis": "reference",
      "source": "EDR Magazine, DSEI 2019 RADA report",
      "url": "https://www.edrmagazine.eu/dsei-2019-rada-two-new-radars-from-israel",
      "date": "2026-09-04"
    },
    "elevationDeg": {
      "value": [
        0,
        90
      ],
      "unit": "deg",
      "grade": "INFERRED",
      "layer": "L2",
      "estimator": "planning-factor",
      "note": "No provenance row; planning factor"
    },
    "maxAltitudeFt": {
      "value": 30000,
      "unit": "ft",
      "grade": "INFERRED",
      "layer": "L2",
      "estimator": "planning-factor",
      "note": "No provenance row; planning factor"
    },
    "resolutionM": {
      "value": 50,
      "unit": "m",
      "grade": "INFERRED",
      "layer": "L2",
      "estimator": "planning-factor",
      "note": "No provenance row; planning factor"
    },
    "rangeAccuracyM": {
      "value": 3,
      "unit": "m",
      "grade": "INFERRED",
      "layer": "L2",
      "estimator": "class-median",
      "comparisonSet": [
        "lib-r8ss"
      ],
      "spread": {
        "kind": "lognormal",
        "sigmaDb": 4
      },
      "note": "Class median of the sourced surveillance radars: lib-r8ss 3; median 3 m."
    },
    "azimuthAccuracyDeg": {
      "value": 0.8,
      "unit": "deg",
      "grade": "INFERRED",
      "layer": "L2",
      "estimator": "class-median",
      "comparisonSet": [
        "lib-r8ss"
      ],
      "spread": {
        "kind": "lognormal",
        "sigmaDb": 4
      },
      "note": "Class median of the sourced surveillance radars: lib-r8ss 0.8; median 0.8 deg."
    },
    "elevationAccuracyDeg": {
      "value": 3,
      "unit": "deg",
      "grade": "INFERRED",
      "layer": "L2",
      "estimator": "class-median",
      "comparisonSet": [
        "lib-r8ss"
      ],
      "spread": {
        "kind": "lognormal",
        "sigmaDb": 4
      },
      "note": "Class median of the sourced surveillance radars: lib-r8ss 3; median 3 deg."
    },
    "falseAlarmRatePerScan": {
      "value": 0.5,
      "unit": "count",
      "grade": "INFERRED",
      "layer": "L2",
      "estimator": "planning-factor",
      "spread": {
        "kind": "lognormal",
        "sigmaDb": 4
      },
      "note": "Planning factor: PLACARD_PFA 1e-6 (src/model/types.ts) times about 1e6 range-azimuth-Doppler cells per scan of a 360° surveillance volume gives about one false alarm per scan over the whole coverage; this 90° sector panel searches about half the cells and is recorded at 0.5. No vendor publishes a false-alarm rate."
    },
    "dwellTimeS": {
      "value": 0.02,
      "unit": "s",
      "grade": "INFERRED",
      "layer": "L2",
      "estimator": "planning-factor",
      "spread": {
        "kind": "lognormal",
        "sigmaDb": 4
      },
      "note": "Planning factor: Leonardo DRS RADA publishes no dwell or CPI. An electronically scanned radar sets its dwell in the beam schedule rather than by beamwidth over scan rate; the literature CPI of 20 ms for X/Ku-band drone-detection AESAs is used. Open literature on X/Ku-band drone-detection AESAs gives a CPI of about 20 ms at 5 kHz PRF (about 100 pulses; arXiv 2307.10326) and about 30 ms at 6 kHz (about 180 pulses; MDPI Drones 7(5):316), and notes that a 2.7 ms dwell barely resolves micro-Doppler."
    },
    "pulsesPerDwell": {
      "value": 100,
      "unit": "count",
      "grade": "INFERRED",
      "layer": "L2",
      "estimator": "planning-factor",
      "spread": {
        "kind": "lognormal",
        "sigmaDb": 4
      },
      "note": "Planning factor: Leonardo DRS RADA publishes no PRF or pulse count. 20 ms dwell at the literature 5 kHz PRF gives 100 pulses coherently integrated. Open literature on X/Ku-band drone-detection AESAs gives a CPI of about 20 ms at 5 kHz PRF (about 100 pulses; arXiv 2307.10326) and about 30 ms at 6 kHz (about 180 pulses; MDPI Drones 7(5):316), and notes that a 2.7 ms dwell barely resolves micro-Doppler."
    }
  },
  "attributes": {
    "sensorType": "radar",
    "role": "surveillance"
  },
  "provenanceOrder": [
    "detectRangeM",
    "sectorDeg"
  ]
}
