{
  "id": "lib-mxgcs",
  "kind": "sensor",
  "type": "eo-ir",
  "version": 3,
  "name": "WESCAM MX-GCS EO/IR sight (L3Harris)",
  "description": "Stabilized cooled MWIR and HD colour sight with eyesafe laser rangefinder on SGT Stout M-SHORAD. Slews 360 deg independent of the turret to identify and track air threats for the 30 mm gun. Ranges are planning figures: none are published.",
  "color": "#8f86ab",
  "builtin": true,
  "spec": "sensor",
  "fields": {
    "detectRangeM": {
      "value": 8000,
      "unit": "m",
      "rangeType": "detection",
      "condition": "8000 m",
      "grade": "UNKNOWN",
      "layer": "L2",
      "basis": "pf",
      "source": "planning factor",
      "url": null,
      "date": "2026-09-04",
      "estimator": "planning-factor"
    },
    "classifyRangeM": {
      "value": null,
      "unit": "m",
      "rangeType": "classification",
      "condition": "no published range — Planning value from SENSOR_ROLE_DEFAULT_RANGE_M['classification'] = 5000 m. Chosen because identification range is always shorter than detection range under DRI convention, and this keeps classify < detect.",
      "grade": "UNKNOWN",
      "layer": "L3",
      "source": "RangeBoard src/model/types.ts SENSOR_ROLE_DEFAULT_RANGE_M, 2026-08-24",
      "url": null,
      "date": "2026-08-24",
      "note": "Inventory records 5000 m at UNKNOWN REPRESENTATIVE; the seed leaves the field null"
    },
    "sectorDeg": {
      "value": 360,
      "unit": "deg",
      "condition": "360 deg scanning, independent of the gun turret",
      "grade": "MANUFACTURER_CLAIM",
      "layer": "L1",
      "basis": "datasheet",
      "source": "L3Harris WESCAM MX-GCS product page",
      "url": "https://www.l3harris.com/all-capabilities/wescam-mx-gcs-independent-stabilized-sighting-system",
      "date": "2026-09-04"
    },
    "elevationDeg": {
      "value": null,
      "unit": "deg",
      "grade": "UNKNOWN",
      "layer": "L3"
    },
    "maxAltitudeFt": {
      "value": null,
      "unit": "ft",
      "grade": "UNKNOWN",
      "layer": "L3"
    },
    "resolutionM": {
      "value": null,
      "unit": "m",
      "grade": "UNKNOWN",
      "layer": "L3"
    },
    "rangeAccuracyM": {
      "value": 5,
      "unit": "m",
      "grade": "INFERRED",
      "layer": "L2",
      "estimator": "planning-factor",
      "spread": {
        "kind": "lognormal",
        "sigmaDb": 4
      },
      "note": "Planning factor: a laser rangefinder is fitted; eyesafe 1.54 µm rangefinders in this class are specified at ±2 to ±5 m and no figure is published for this unit, so 5 m is recorded."
    },
    "azimuthAccuracyDeg": {
      "value": 0.03,
      "unit": "deg",
      "grade": "INFERRED",
      "layer": "L2",
      "estimator": "planning-factor",
      "spread": {
        "kind": "lognormal",
        "sigmaDb": 4
      },
      "note": "Planning factor: a stabilised sighting gimbal reports its line of sight to about 0.5 mrad (0.03°); L3Harris and Leonardo DRS state high-accuracy position feedback without a figure. The sourced HDC MR pan-tilt (0.5 mrad) and CM262 gimbal (80 µrad) bracket it."
    },
    "elevationAccuracyDeg": {
      "value": 0.03,
      "unit": "deg",
      "grade": "INFERRED",
      "layer": "L2",
      "estimator": "planning-factor",
      "spread": {
        "kind": "lognormal",
        "sigmaDb": 4
      },
      "note": "Planning factor: a stabilised sighting gimbal reports its line of sight to about 0.5 mrad (0.03°); L3Harris and Leonardo DRS state high-accuracy position feedback without a figure. The sourced HDC MR pan-tilt (0.5 mrad) and CM262 gimbal (80 µrad) bracket it."
    },
    "pixelPitchUm": {
      "value": 15,
      "unit": "um",
      "grade": "INFERRED",
      "layer": "L2",
      "estimator": "planning-factor",
      "spread": {
        "kind": "lognormal",
        "sigmaDb": 4
      },
      "note": "Planning factor: the 2016 PDS gives a 640 x 512 3 to 5 µm staring array and no pitch; 640 x 512 cooled MWIR cores of that generation are a 15 µm format. The current L3Harris page says only 'mid-wave large-format cooled thermal imager', so a newer core may have replaced it."
    },
    "focalLengthMm": {
      "value": 275,
      "unit": "mm",
      "grade": "INFERRED",
      "layer": "L2",
      "estimator": "planning-factor",
      "spread": {
        "kind": "lognormal",
        "sigmaDb": 4
      },
      "note": "Planning factor: L3Harris publishes no focal length. From the PDS 2.0° narrow field and an assumed 15 µm × 640 px = 9.6 mm array width: 9.6 / (2 tan 1.0°) = 275 mm."
    },
    "detectorPixelsH": {
      "value": 640,
      "unit": "count",
      "condition": "thermal imager, 3 to 5 µm staring array, 640 x 512",
      "grade": "REPORTED",
      "layer": "L1",
      "basis": "datasheet",
      "source": "L3 WESCAM MX-GCS product data sheet (November 2016, reseller-hosted PDF)",
      "url": "https://www.militarysystems-tech.com/sites/militarysystems/files/supplier_docs/PDS-MX-GCS-November-2016.pdf",
      "date": "2026-09-10"
    },
    "fovDeg": {
      "value": 2,
      "unit": "deg",
      "condition": "thermal imager dual field of view 2.0° and 10.0°, narrow field",
      "grade": "REPORTED",
      "layer": "L1",
      "basis": "datasheet",
      "source": "L3 WESCAM MX-GCS product data sheet (November 2016, reseller-hosted PDF)",
      "url": "https://www.militarysystems-tech.com/sites/militarysystems/files/supplier_docs/PDS-MX-GCS-November-2016.pdf",
      "date": "2026-09-10",
      "spread": {
        "kind": "lognormal",
        "sigmaDb": 2
      }
    },
    "mrtdMk": {
      "value": 25,
      "unit": "mK",
      "grade": "INFERRED",
      "layer": "L2",
      "estimator": "planning-factor",
      "spread": {
        "kind": "lognormal",
        "sigmaDb": 4
      },
      "note": "Planning factor: L3Harris publishes no MRTD or NETD. Cooled MWIR cores publish NETD of 20 mK (Lynred Daphnis-HD MW), <25 mK (Teledyne FLIR Neutrino SX12) and <30 mK (DRS HexaBlu 1280-MW); the 25 mK median is used as the low-spatial-frequency MRTD."
    }
  },
  "attributes": {
    "sensorType": "eo-ir",
    "role": "fire-control",
    "eoBand": "dual",
    "rangeBasis": "planning"
  },
  "provenanceOrder": [
    "detectRangeM",
    "eoBand",
    "sectorDeg"
  ],
  "attributeProvenance": {
    "eoBand": {
      "value": "dual: mid-wave cooled thermal imager plus an HD daylight sensor",
      "source": "L3Harris WESCAM MX-GCS product page",
      "url": "https://www.l3harris.com/all-capabilities/wescam-mx-gcs-independent-stabilized-sighting-system",
      "date": "2026-09-04",
      "basis": "datasheet",
      "grade": "MANUFACTURER_CLAIM",
      "layer": "L1"
    }
  }
}
