{
  "id": "lib-shahed136",
  "kind": "uas",
  "type": "one-way-attack",
  "version": 1,
  "name": "Red air: Shahed-136 / Geran-2 OWA (G3)",
  "description": "Delta-wing one-way-attack, launched in salvos hundreds of km out. Low river-valley ingress or 10-16 kft cruise with terminal dive.",
  "color": "#ab4c3e",
  "builtin": true,
  "spec": "uas",
  "fields": {
    "group": {
      "value": 3,
      "unit": "uas-group",
      "grade": "INFERRED",
      "layer": "L2",
      "estimator": "planning-factor",
      "note": "No provenance row; planning factor"
    },
    "rcsM2": {
      "value": 0.2,
      "unit": "m2",
      "condition": "0.2 m2",
      "grade": "INFERRED",
      "layer": "L2",
      "basis": "pf",
      "source": "planning factor",
      "url": null,
      "date": "2026-09-04",
      "estimator": "planning-factor"
    },
    "spanM": {
      "value": 2.5,
      "unit": "m",
      "condition": "2.5 m wingspan",
      "grade": "REPORTED",
      "layer": "L1",
      "basis": "reference",
      "source": "Janes",
      "url": "https://www.janes.com/osint-insights/defence-news/air/irgc-confirms-specs-for-shahed-136-attack-uav",
      "date": "2026-09-04"
    },
    "acousticDb": {
      "value": 100,
      "unit": "dB",
      "grade": "INFERRED",
      "layer": "L2",
      "estimator": "planning-factor",
      "note": "No provenance row; planning factor"
    },
    "cruiseSpeedMps": {
      "value": 50,
      "unit": "mps",
      "condition": "185 km/h from the MD550 engine (51.4 m/s), read as cruise",
      "grade": "REPORTED",
      "layer": "L1",
      "basis": "reference",
      "source": "Janes",
      "url": "https://www.janes.com/osint-insights/defence-news/air/irgc-confirms-specs-for-shahed-136-attack-uav",
      "date": "2026-09-04"
    },
    "maxSpeedMps": {
      "value": 64,
      "unit": "mps",
      "grade": "INFERRED",
      "layer": "L2",
      "estimator": "planning-factor",
      "note": "No provenance row; planning factor"
    },
    "enduranceMin": {
      "value": 600,
      "unit": "min",
      "grade": "INFERRED",
      "layer": "L2",
      "estimator": "planning-factor",
      "note": "No provenance row; planning factor"
    },
    "altBandFt": {
      "value": [
        200,
        16000
      ],
      "unit": "ft",
      "grade": "INFERRED",
      "layer": "L2",
      "estimator": "planning-factor",
      "note": "No provenance row; planning factor"
    },
    "controlLinkRangeM": {
      "value": null,
      "unit": "m",
      "grade": "UNKNOWN",
      "layer": "L3"
    },
    "operatingRadiusM": {
      "value": 1000000,
      "unit": "m",
      "grade": "INFERRED",
      "layer": "L2",
      "estimator": "planning-factor",
      "note": "No provenance row; planning factor"
    },
    "combatRadiusM": {
      "value": 900000,
      "unit": "m",
      "grade": "INFERRED",
      "layer": "L2",
      "estimator": "planning-factor",
      "note": "No provenance row; planning factor"
    },
    "warheadKg": {
      "value": 40,
      "unit": "kg",
      "grade": "INFERRED",
      "layer": "L2",
      "estimator": "planning-factor",
      "note": "No provenance row; planning factor"
    },
    "effectRadiusM": {
      "value": 80,
      "unit": "m",
      "grade": "INFERRED",
      "layer": "L2",
      "estimator": "planning-factor",
      "note": "No provenance row; planning factor"
    },
    "standoffRangeM": {
      "value": null,
      "unit": "m",
      "grade": "UNKNOWN",
      "layer": "L3"
    }
  },
  "attributes": {
    "airframe": "one-way-attack",
    "navMode": "inertial",
    "emissionsNote": "RF silent en route; some variants add SATCOM or cellular",
    "oneWay": true,
    "rangeNote": "Strike routes 600-900+ km with evasive doglegs; Kometa anti-jam GNSS and jet-powered variants reported.",
    "weaponProfile": "impact",
    "jamBehavior": "continue",
    "linkBands": [
      "gnss"
    ]
  },
  "provenanceOrder": [
    "rcsM2",
    "spanM",
    "cruiseSpeedMps",
    "linkBands"
  ],
  "attributeProvenance": {
    "linkBands": {
      "value": "GNSS: NASIR satellite receiver",
      "source": "Ukraine Defence Intelligence (HUR) War & Sanctions portal",
      "url": "https://war-sanctions.gur.gov.ua/en/page-shahed-136",
      "date": "2026-09-04",
      "basis": "reference",
      "grade": "REPORTED",
      "layer": "L1"
    }
  },
  "threatProfile": {
    "designator": "THR-G3-OWA-01",
    "routeIntent": "Stream raid along a corridor, minutes apart",
    "altitudeFt": 2000,
    "speedMps": 50,
    "count": 1
  }
}
